Title,Department,Institution,Abstract,Start Date,End Date,Funding Agency,Researchers,Topic
OPTIMIZING IMTA SPECIES COMPONENT STOCKING DENSITIES AND INFRASTRUCTURE ORIENTATION TO MAXIMIZE OVERALL SYSTEM EFFICIENCY,,Fisheries and Oceans Canada (DFO); University of New Brunswick - St. John (UNBSJ); University of Victoria (UVic); Cooke Aquaculture Inc.; Kyuquot SEAfoods Ltd.,"Expanding our knowledge of nutrient transfer within current IMTA site designs will help the industry develop their infrastructure. Developing the aquaculture of the California Sea Cucumber (Parastichopus californicus), as a benthic extractive species within IMTA systems, and addressing issues such as its containment, will be mutually beneficial to resource managers and industry partners. To improve the sustainability of IMTA systems, extractive species’ stocking densities and infrastructure orientations need to be optimised such that they maximise the interception of fish-farm nutrients and IMTA efficiency. In order to achieve this objective, the dynamics of nutrient transfer within the site needs to be understood to choose the best configuration and species mix. On the east coast, empirical studies on flow patterns, organic particle densities, and their utilization by farmed and wild species are studied on conventional salmon and IMTA sites to provide input on a model for site efficiency. On the west coast, the project is focused on optimizing the benthic extraction of nutrients within an IMTA system using the detritus-feeding California Sea Cucumber, P. californicus. The California Sea Cucumber has been established as a promising candidate for IMTA due to its ability to extract benthic nutrients and its high market value. The potential for suspended trays within an IMTA system, as juvenile rearing habitat for P. californicus, are further examined. A suspended-tray design is being investigated in order to optimize nutrient delivery, water quality, and stocking density, while decreasing bio-fouling and addressing containment issues of juvenile P. californicus.",JAN. 2013,DEC. 2015,Natural Sciences and Engineering Research Council (NSERC) Strategic Network Program; Fisheries and Oceans Canada (DFO); University of New Brunswick (UNB); New Brunswick Research Productivity Council (NBRPC); Cooke Aquaculture Inc.; Kyuquot SEAfoods Ltd.; Marine Harvest Canada Ltd.; Grieg Seafood BC Ltd. ,"Shawn Robinson (DFO); Bruce MacDonald, Taryn Minch, Thierry Chopin (UNBSJ); Gregor Reid (UNBSJ, DFO); Chris Pearce (DFO); Stephen Cross, Angela Fortune (UVic); Cooke Aquaculture Inc.; Kyuquot SEAfoods Ltd.",Aquaculture - CIMTAN
LOMA SALMONAE: A MICROSPORIDIAN MODEL TO HELP ASSESS TRANSMISSION DYNAMICS OF PATHOGENS WITHIN AN IMTA SETTTING,,University of Prince Edward Island (UPEI),"The introduction of a bivalve component alongside a salmon growing operation may provide beneficial disease reduction services. A greater understanding of disease dynamics between trophic levels is a key part of health management within integrated settings. Our goal has been to modify an infection model for the microsporidian pathogen Loma salmonae, and use this model to evaluate the role that Blue Mussels may have to act as environmentally released spores within an IMTA setting. Specifically, asking the question of whether Blue Mussels may serve to mitigate disease transmission by deactivating spores that they encounter during feeding. The model has been successfully developed and now allows us to modify various environmental and temporal parameters. A very useful, and unexpected outcome, was the establishment of L. salmonae within cell culture. This advance will allow far greater flexibility in our studies, both as a tool for producing spores, but also for detecting them within environmental niches under study. To date, we have determined that Blue Mussels are very effective in extracting microsporidial spores from the environmnent; spores are subsequently released in pseudofeces, or feces, and small proportion of them stored for several weeks within mussel viscera. Spores are not rendered defective whether they are retained, or passed within egesta; in vitro tests of spore viability have been evaluated against the gold standard in vivo measures of infectivity.",JAN. 2010,DEC. 2015,Natural Sciences and Engineering Research Council (NSERC) Strategic Network Program; Fisheries and Oceans Canada (DFO); University of New Brunswick (UNB); New Brunswick Research Productivity Council (NBRPC); Cooke Aquaculture Inc.; Kyuquot SEAfoods Ltd.; Marine Harvest Canada Ltd.; Grieg Seafood BC Ltd. ,"Dave Speare (UPEI-AVC); Sarah McConnachie, Nicole Guselle (UPEI-AVC)",Aquaculture - CIMTAN
"SOCIAL IMPLICATIONS OF IMTA: SOCIAL-ECOLOGICAL RESILIENCE IN BAYNES SOUND, BRITISH COLUMBIA",,Vancouver Island University (VIU),"When asked to weigh the costs and benefits of the industry, most participants expressed uncertainty. This uncertainty may indicate ongoing struggles to balance what many feel are largely economic benefits against experiential and environmental concerns. It may also signal that participants have not yet fully formed a solidly positive or negative opinion of the industry, offering an opportunity to the shellfish industry. As a relatively new industry, it is unclear how aquaculture affects the well-being of the social-ecological systems in which it is embedded. Baynes Sound farms produce half of all shellfish cultured in British Columbia, over 3,700 tonnes per year, and are surrounded by more than 6,500 residents on Vancouver Island and Denman Island. To ensure the ecological, economic, and social sustainability of Baynes Sound, and other social-ecological systems, the aquaculture industry must be better understood. The concept of well-being helps us move beyond simple “jobs versus the environment” understandings of effects, and provides a more holistic way to understand the preferences the residences of Baynes Sound have for social-ecological conditions and the ways in which these conditions may be enhanced or diminished by shellfish aquaculture activities. The purpose of this research study was to identify and measure the perceived effects of shellfish aquaculture on the Baynes Sound social-ecological system. Over a three year period, we used qualitative interviews, surveys, focus groups, and a photo-voice component to answer the question: what are the mechanisms by which the activities of the shellfish aquaculture industry promote and/or erode community well-being in the Baynes Sound social-ecological system as assessed by local residents?",JAN. 2010,DEC. 2015,Natural Sciences and Engineering Research Council (NSERC) Strategic Network Program; Fisheries and Oceans Canada (DFO); University of New Brunswick (UNB); New Brunswick Research Productivity Council (NBRPC); Cooke Aquaculture Inc.; Kyuquot SEAfoods Ltd.; Marine Harvest Canada Ltd.; Grieg Seafood BC Ltd. ,Grant Murray (VIU); Linda D’Anna (VIU),Aquaculture - CIMTAN
IMPROVING OYSTER (CRASSOSTREA VIRGINICA) SEEDSTOCK PRODUCTION IN NOVA SCOTIA,,University of British Columbia (UBC); Dalhousie University (Dalhousie U); Gulf Aquaculture Association (GAA),"The demand for oyster in the USA and European markets is increasing, but the traditional sources of supply have been faced with increasing stresses due to both anthropological causes (e.g., oil spill in the Gulf of Mexico) and extreme environmental changes. The international markets are seeking supply from Canadian waters, but the production of oysters in Atlantic Canada, particularly from Nova Scotia, could not cope with the increasing demand. Recognizing this great market opportunity, the shellfish producers in Nova Scotia approached NS Department of Fisheries and Aquaculture (NSDFA) and the Aquaculture Centre at Dalhousie University to assist the industry to improve oyster production in the province. With financial assistance from NSDFA and Gulf Aquaculture Association (GAA), Jesse Ronquillo and his research team developed innovative hatchery procedures for improved method in oyster seedstock production using various spawning induction techniques and continuous production of selected microalgal species rich in omega-3 fatty acids for faster growth and increased survival rate of seedstock. More than 500 million pediveligers or eyed-larvae were produced for remote setting and grow-out operations of shellfish growers in Northumberland Strait. The inexpensive and innovative hatchery production techniques developed through the collaborative project can be adopted by shellfish growers to produce oyster seedstock without extensive investment on costly infrastructure and equipment. The use of newly developed technology for the production of healthy and good quality oyster seedstock for remote setting will enhance shellfish production in Nova Scotia.",MAR. 2012,OCT. 2012,"Nova Scotia Department of Fisheries and Aquaculture (NSDFA); Gulf Aquaculture Association (GAA)

",Jesse Ronquillo (UBC); Audrie-Jo McConkey (Dalhousie U); Paul Budrewski (GAA); Ronakkumar Desai (Dalhousie U),Aquaculture - Shellfish
YEAR-ROUND SPAWNING AND LARVAL REARING OF GEODUCK (PANOPEA GENEROSA) IN CLOSED CULTURE SYSTEM,,"University of British Columbia (UBC); BC Pacific Oyster Ltd. (BCPOL)
","This simple and inexpensive closed-culture system for geoduck spawning can be replicated as needed. The portability of the University of British Columbia’s (UBC) design of a seawater filtration system can be adopted to prevent microbial contamination during microalgae production and for inducing geoduck broodstock spawning. The developed protocol for inducing broodstock spawning will improve geoduck gamete production and simplify hatchery operations. Geoduck is the most important commercial shellfish species in British Columbia. Unfortunately, commercial production is limited by the reliable supply of high quality hatchery-produced juveniles. Developing viable and sustainable culture protocols for this species will provide the industry with the needed seedstock to expand production. Benefits from expansion include new economic and employment opportunities for shellfish growers, seafood exporters, and First Nations communities plus a new source of sustainably produced seafood products. The UBC and British Columbia Pacific Oysters, Ltd. (BCPOL) have established a research collaboration to develop sustainable geoduck aquaculture production techniques through NSERC Engage and Engage Plus Grants. The preliminary research outcomes include: 
(1) design and construction of a prototype closed-culture system for controlled geoduck spawning; 
(2) fabrication of an elegant yet inexpensive seawater filtration system; 
(3) successful induction of geoduck broodstock spawning based on environmental manipulation among desiccation, temperature shifts, UV-filtered water stimulation, microalgal addition, and various combinations of the above; and 
(4) Successful development of inexpensive system for efficient and continuous culture of microalgae for feeding geoduck seedstock.
",APR. 2014,SEP. 2014,"Natural Sciences and Engineering Research Council (NSERC) Engage; BC Pacific Oyster Ltd. (BCPOL)

","Andrew Riseman (UBC); Jesse Ronquillo (UBC); Tony Farrell (UBC); John Zhang, Daniel McDermid (BCPOL",Aquaculture - Shellfish
EARLY DEVELOPMENTAL STAGES OF GEODUCK (PANOPEA GENEROSA),,University of British Columbia (UBC); Dalhousie University (Dalhousie U); BC Pacific Oyster Ltd. (BCPOL),"BC Pacific Oysters Ltd. (BCPOL), a Canadian company with a 12.7 hectare grow-out aquaculture facility in Jervis Inlet, British Columbia, has established a partnership with the Faculty of Agriculture, Dalhousie University (formerly Nova Scotia Agricultural College) and the University of British Columbia for the development of a commercial hatchery and seedstock production of geoduck (Panopea generosa). The initial research project activities focused on documenting the early embryonic and post-embryonic stages of geoduck to develop a hatchery production protocol. Geoduck broodstock were spawned through natural means and the larvae were reared until early juvenile stage. Primary results showed that after 50 days of culture from spawning, the juveniles reached approximately 7 to 12 mm shell length by feeding on microalgae such as chlorophyte, baccilariophyte, chrysophyte, and prymnesiophyte rich in protein with high level of omega-3 fatty acids. Survival rate was more than 90%, and no disease was found based on juvenile geoduck pathogen analysis conducted at Pacific Biological Station of the Department of Fisheries and Oceans Canada (DFO). The preliminary research results were very promising for the development of a viable commercial geoduck hatchery production system. The initial results demonstrate the feasibility of developing a viable commercial hatchery production of healthy and good quality geoduck seedstock in Canada to supply the needs of geoduck growers in British Columbia and the United States. ",APR. 2009,SEP. 2014,BC Pacific Oyster Ltd. (BCPOL),"Jesse Ronquillo (UBC); Audrie-Jo McConkey (Dalhousie U); Andrew Riseman, Tony Farrell (UBC); John Zhang, Daniel McDermid (BCPOL)",Aquaculture - Shellfish
ARE SHELLFISH TRANSFERS A LIKELY VECTOR FOR AQUATIC INVASIVE SPECIES MOVEMENT FROM THE WEST TO THE EAST COAST OF VANCOUVER ISLAND?,,"Fisheries and Oceans Canada (DFO); Mac’s Oysters Ltd., BC; Canadian Fod Inspection Agency (CFIA)","The transfer of shellfish (including clams, oysters, and mussels) from areas infested with Non-Indigenous Species (NIS) can be a vector for both mobile and sessile NIS. There are currently no mitigation measures that are 100% effective in removing or destroying NIS on cultured shellfish. The objective of this study was to assess shellfish transfers by the shellfish industry and the Canadian Food Inspection Agency’s (CFIA ) biotoxin monitoring program as potential vectors for the spread of aquatic invasive species (AIS), with particular focus on the European Green Crab, from the west to the east coast of Vancouver Island. The project quantified the potential risk of AIS introduction associated with current shellfish transfer protocols. Based on the results of the experimental and processor studies, the present conditions of licence do not eliminate the risk of transferring NIS. The gaps identified suggest that the intended reduction in propagule pressure is not being realized under current management/ regulatory strategies. A conceptual framework was developed to identify potential control points where management intervention, such as the development of scientifically-based shellfish aquaculture management zones and the application of license conditions could be used to lower propagule pressure and hence invasion risk in British Columbia.",APR. 2011,MAR. 2014,DFO – Program for Aquaculture Regulatory Research (DFO – PARR),"Chris Pearce, Hannah Stewart (DFO); Tom Therriault, Graham Gillespie, Lyanne Burgoyne (DFO); Gordy McLellan (Mac’s Oysters Ltd., BC); Deidre Kelly (CFIA)",Aquaculture - Shellfish
QUAHOG (MERCENARIA MERCENARIA) SEEDSTOCK PRODUCTION FOR REMOTE SETTING IN NOVA SCOTIA,,"University of British Columbia (UBC); Dalhousie University (Dalhousie U); Gulf Aquaculture Association (GAA)
","Quahog or hard clam (Mercenaria mercenaria) is an edible marine bivalve mollusc commonly found along the eastern shores of North America and Central America, ranging from Prince Edward Island to the Yucatan Peninsula. Due to strong market demand, there has been an interest to expand the production of quahogs in the Maritimes. The Gulf Aquaculture Association (GAA), based in Northumberland Strait, requested assistance from Nova Scotia Department of Fisheries and Aquaculture (NSDFA) and the Aquaculture Centre at Dalhousie University to assist the industry to improve quahog production in the province. Jesse Ronquillo (Principal Investigator) and Audrie-Jo McConkey (Shellfish Instructor and Algologist) devised innovative procedures in the spawning and larval rearing of quahog to produce the needed seedstock. Selected species of microalgae rich in highly unsaturated fatty acids (HUFA) were mass-produced continuously in an inventive way to provide abundant and diversified source of live feeds to larvae until they reach pediveliger or eyed-larvae that were used by shellfish growers in Northumberland Strait for remote setting. Over 97 million seedstock were produced in about a month for the grow-out operations of the shellfish growers in Nova Scotia. The developed protocol for inducing broodstock spawning could improve quahog gamete production and simplify hatchery operations and management. The innovative technique for efficient and inexpensive culture of microalgae can be replicated as needed to improve commercial shellfish hatchery production and operations. ",MAR. 2012,OCT. 2012,"Nova Scotia Department of Fisheries and Aquaculture (NSDFA); Gulf Aquaculture Association (GAA)

",Jesse Ronquillo (UBC); Audrie-Jo McConkey (Dalhousie U); Paul Budrewski (GAA); Ronakkumar Desai (Dalhousie U),Aquaculture - Shellfish
OCEAN ACIDIFICATION EFFECTS ON SHELLFISH AQUACULTURE,,"Fisheries and Oceans Canada (DFO); Island Scallops, Island Sea Farms Inc.; Taylor Shellfish Farms Canada; Limberis Seafoods Ltd.; Odyssey Shellfish Ltd.; Kyuquot Seafoods Ltd.","Rising atmospheric CO2 levels increases pCO2 in seawater, lowering the pH and causing ocean acidification which can profoundly affect shellfish aquaculture. Surface pCO2 can also rise in coastal regions due to the upwelling of deep, ancient water. While pCO2 levels are anticipated to rise consistently in the greater ocean due to elevated atmospheric CO2, coastal upwelling regions are already experiencing dramatic fluctuations in pCO2 that encompass the upper limits expected in the greater ocean in over 100 years’ time. Coincident with observations of enhanced pCO2 variation and potentially a higher average pCO2 experience along the BC and Washington State coastlines has been dramatic failures of shellfish aquaculture production both in the hatcheries and in ocean grow-out sites. This project was undertaken to begin collecting data and information in support of a causal link between reduced industry performance and pCO2, as well as to identify vulnerable developmental stages and physiologies. A clear signature of development was observed in the microarray data for both scallops and oysters. However, while there appeared to be a negative growth response to elevated pCO2 during some time periods, there was no consistent gene expression pattern differentiating treatments in the microarray data. However, it was found that there may be some level of acclimation possible, i.e., individuals that survive adverse conditions as larvae will perform better under those conditions as juveniles. This may point to an alternate larval rearing strategy that may benefit industry through the rearing of larvae under sub-lethal adverse conditions and selecting the most robust for settling and ocean ranching.",APR. 2011,JUL. 2013,"DFO – Aquaculture Collaborative Research and Development Program (DFO – ACRDP); Island Scallops; Island Sea Farms Inc.; Taylor Shellfish Farms Canada; Limberis Seafoods Ltd.; Odyssey Shellfish Ltd.; Kyuquot Seafoods Ltd.

","Kristi Miller-Saunders (DFO); Island Scallops, Island Sea Farms Inc.; Taylor Shellfish Farms Canada; Limberis Seafoods Ltd.; Odyssey Shellfish Ltd.; Kyuquot Seafoods Ltd.",Aquaculture - Shellfish
"DEVELOPING A CARRYING CAPACITY FRAMEWORK FOR BAYNES SOUND, BRITISH COLUMBIA",,Fisheries and Oceans Canada (DFO),"Shellfish aquaculture is an important activity in coastal environments. Successful culture of suspension-feeding shellfish relies heavily on the supply of phytoplankton food which is mainly controlled by hydrodynamic factors in estuaries with strong gradients in flushing characteristics (e.g., Baynes Sound, Strait of Georgia, B.C.). Large cultured bivalve populations may potentially deplete particles from the water column much faster than flushing or phytoplankton production can renew them on a local scale (farm depletion). Although re-suspension events or organic-rich sediments may provide a buffer against a fluctuating planktonic food supply, areas prone to re-suspension of silt-laden flocs may shutdown feeding of shellfish. The main objective of this project is to develop a carrying capacity model for shellfish production in Baynes Sound. The project will focus on establishing a particulate budget for the Sound and providing a real-time assessment of the current state of benthic and pelagic conditions in support of the development of siting criteria. Longer term goals involve developing circulation and nutrient models that describe the hydrodynamic and biological controls on particulate concentrations in Baynes Sound. These models will be coupled with shellfish assimilative estimates to determine the influence of shellfish production on benthic and water column quality. ",APR. 2011 ,MAR. 2015,"DFO – Program for Aquaculture Regulatory Research (DFO – PARR)
","Terri Sutherland (DFO); Peter Cranford, Chris Pearce, Hannah Stewart (DFO)",Aquaculture - Shellfish
DETERMINATION OF OPTIMAL MICROALGAL DIETS AND FEEDING RATIONS FOR LARVAE AND SEED OF THE GEODUCK CLAM (PANOPEA GENEROSA) ,,"Fisheries and Oceans Canada (DFO); University of British Columbia (UBC); Klahoose Shellfish Limited Partnership; Key Laboratory of Mariculture, Ministry of Education, Ocean University of China, Qingdao, China","The geoduck clam aquaculture industry has been constrained by the lack of a reliable seed supply (due to very high larval mortality), indicating significant problems with the current hatchery production strategies. In order to establish hatcheryrearing protocols of a cultured bivalve species, it is necessary to examine a number of biotic and abiotic factors, such as temperature, diet quality, and diet quantity. This research aimed to determine optimal temperature, microalgal diets, and feeding rations for P. generosa larvae and seed. Optimum microalgal diets were identified for larval and young juvenile geoduck clams. Optimum temperature and rations were identified for various size classes of young juvenile clams. These results will improve the reliability and production capacity of geoduck hatcheries in British Columbia and will help alleviate the hatchery bottleneck in the culture of geoduck clams. With improved hatchery knowledge, the aquaculture industry will be able to produce more geoduck seed (and more reliably) for outplanting. ",AUG. 2010,OCT. 2013,DFO – Aquaculture Collaborative Research and Development Program (DFO – ACRDP); Klahoose Shellfish Limited Partnership ,"Chris Pearce (DFO); Wenshan Liu, Ian Forster (DFO); Scott McKinley, Bianca Arney (UBC); Yichao Ren (Key Laboratory of Mariculture, Ministry of Education, Ocean University of China, Qingdao, China); Klahoose Shellfish Limited Partnership ",Aquaculture - Shellfish
FISH-KELP CO-CULTURE: A FEASIBILITY STUDY FOR THE COMMERCIAL SCALE INTEGRATION OF KELP CULTURE WITH FINFISH PRODUCTION IN COASTAL BRITISH COLUMBIA,,North Island College (NIC); University of Victoria (UVic); Creative Salmon; Marine Harvest Canada Limited; Grieg Seafood BC Ltd.; Cermaq Canada Ltd.; SEA Vision Group,"This research will provide a detailed technical and socio-economic assessment for the development of a kelp aquaculture sector in coastal British Columbia. This project critically evaluates the commerical-scale production potential for Laminaria kelps adjacent to the fish farm facilities in coastal British Columbia. Historical water quality data and performance trails at 15 farm sites will be used to assess growth rates, tissue quality, and annual extrapolated production capacity among the farm sites given available tenure space. The analysis will include production capacity, product positioning and markets, product value, capital and operating costs, secondary industry support requirements, staffing and training needs, business models, and sector growth potential. Initial (Year 1) farm trial results indicated a 38% enhanced growth of kelp cultured within the nutrient plume downstream of a fish farm, supporting the anticipated and additional benefits of environmental impact mitigation using this basic, Intergated Bi-Trophic Aquaculture approach. 

",JUL. 2013,JUN. 2018,Natural Sciences and Engineering Research Council (NSERC),Stephen Cross (NIC – CARTI); Nicholas Sherrington (UVic); Creative Salmon; Marine Harvest Canada Limited; Grieg Seafood BC Ltd.; Cermaq Canada Ltd.; SEA Vision Group,Aquaculture 
